{
  "artifact_kind": "VSG_GENERATION_CONTRACT",
  "constraints": [
    {
      "id": "action:ks_banner",
      "lock_ids": [
        "GL-SEM-KS_BANNER"
      ],
      "priority": "P0",
      "source_refs": [
        {
          "artifact": "sar2",
          "collection": "action_plan",
          "id": "ks_banner"
        },
        {
          "artifact": "sar2",
          "collection": "entities",
          "id": "ks_banner"
        },
        {
          "artifact": "vsg",
          "collection": "nodes",
          "id": "ks_banner"
        }
      ],
      "trace_event_ids": [],
      "value": "PRESERVE_EXACT"
    },
    {
      "id": "action:ks_context",
      "lock_ids": [],
      "priority": "P2",
      "source_refs": [
        {
          "artifact": "sar2",
          "collection": "action_plan",
          "id": "ks_context"
        },
        {
          "artifact": "sar2",
          "collection": "entities",
          "id": "ks_context"
        },
        {
          "artifact": "vsg",
          "collection": "nodes",
          "id": "ks_context"
        }
      ],
      "trace_event_ids": [],
      "value": "PRESERVE_CONTEXT"
    },
    {
      "id": "action:ks_door",
      "lock_ids": [
        "GL-GEO-KS_DOOR"
      ],
      "priority": "P0",
      "source_refs": [
        {
          "artifact": "sar2",
          "collection": "action_plan",
          "id": "ks_door"
        },
        {
          "artifact": "sar2",
          "collection": "entities",
          "id": "ks_door"
        },
        {
          "artifact": "vsg",
          "collection": "nodes",
          "id": "ks_door"
        }
      ],
      "trace_event_ids": [],
      "value": "PRESERVE_EXACT"
    },
    {
      "id": "action:ks_facade",
      "lock_ids": [
        "GL-GEO-KS_FACADE"
      ],
      "priority": "P0",
      "source_refs": [
        {
          "artifact": "sar2",
          "collection": "action_plan",
          "id": "ks_facade"
        },
        {
          "artifact": "sar2",
          "collection": "entities",
          "id": "ks_facade"
        },
        {
          "artifact": "vsg",
          "collection": "nodes",
          "id": "ks_facade"
        }
      ],
      "trace_event_ids": [],
      "value": "PRESERVE_EXACT"
    },
    {
      "id": "action:ks_left_display",
      "lock_ids": [
        "GL-GEO-KS_LEFT_DISPLAY"
      ],
      "priority": "P0",
      "source_refs": [
        {
          "artifact": "sar2",
          "collection": "action_plan",
          "id": "ks_left_display"
        },
        {
          "artifact": "sar2",
          "collection": "entities",
          "id": "ks_left_display"
        },
        {
          "artifact": "vsg",
          "collection": "nodes",
          "id": "ks_left_display"
        }
      ],
      "trace_event_ids": [],
      "value": "PRESERVE_EXACT"
    },
    {
      "id": "action:ks_lower_panels",
      "lock_ids": [],
      "priority": "P1",
      "source_refs": [
        {
          "artifact": "sar2",
          "collection": "action_plan",
          "id": "ks_lower_panels"
        },
        {
          "artifact": "sar2",
          "collection": "entities",
          "id": "ks_lower_panels"
        },
        {
          "artifact": "vsg",
          "collection": "nodes",
          "id": "ks_lower_panels"
        }
      ],
      "trace_event_ids": [],
      "value": "PRESERVE_CHARACTER"
    },
    {
      "id": "action:ks_main_sign",
      "lock_ids": [
        "GL-SEM-KS_MAIN_SIGN"
      ],
      "priority": "P0",
      "source_refs": [
        {
          "artifact": "sar2",
          "collection": "action_plan",
          "id": "ks_main_sign"
        },
        {
          "artifact": "sar2",
          "collection": "entities",
          "id": "ks_main_sign"
        },
        {
          "artifact": "vsg",
          "collection": "nodes",
          "id": "ks_main_sign"
        }
      ],
      "trace_event_ids": [],
      "value": "PRESERVE_EXACT"
    },
    {
      "id": "action:ks_right_display",
      "lock_ids": [
        "GL-GEO-KS_RIGHT_DISPLAY"
      ],
      "priority": "P0",
      "source_refs": [
        {
          "artifact": "sar2",
          "collection": "action_plan",
          "id": "ks_right_display"
        },
        {
          "artifact": "sar2",
          "collection": "entities",
          "id": "ks_right_display"
        },
        {
          "artifact": "vsg",
          "collection": "nodes",
          "id": "ks_right_display"
        }
      ],
      "trace_event_ids": [],
      "value": "PRESERVE_EXACT"
    },
    {
      "id": "action:ks_sale_strip",
      "lock_ids": [],
      "priority": "P1",
      "source_refs": [
        {
          "artifact": "sar2",
          "collection": "action_plan",
          "id": "ks_sale_strip"
        },
        {
          "artifact": "sar2",
          "collection": "entities",
          "id": "ks_sale_strip"
        },
        {
          "artifact": "vsg",
          "collection": "nodes",
          "id": "ks_sale_strip"
        }
      ],
      "trace_event_ids": [],
      "value": "PRESERVE_CHARACTER"
    },
    {
      "id": "action:ks_sidewalk",
      "lock_ids": [],
      "priority": "P2",
      "source_refs": [
        {
          "artifact": "sar2",
          "collection": "action_plan",
          "id": "ks_sidewalk"
        },
        {
          "artifact": "sar2",
          "collection": "entities",
          "id": "ks_sidewalk"
        },
        {
          "artifact": "vsg",
          "collection": "nodes",
          "id": "ks_sidewalk"
        }
      ],
      "trace_event_ids": [],
      "value": "PRESERVE_CONTEXT"
    },
    {
      "id": "action:ks_upper_windows",
      "lock_ids": [
        "GL-GEO-KS_UPPER_WINDOWS"
      ],
      "priority": "P0",
      "source_refs": [
        {
          "artifact": "sar2",
          "collection": "action_plan",
          "id": "ks_upper_windows"
        },
        {
          "artifact": "sar2",
          "collection": "entities",
          "id": "ks_upper_windows"
        },
        {
          "artifact": "vsg",
          "collection": "nodes",
          "id": "ks_upper_windows"
        }
      ],
      "trace_event_ids": [],
      "value": "PRESERVE_EXACT"
    },
    {
      "id": "directive:forbid",
      "lock_ids": [],
      "priority": "REQUIRED",
      "source_refs": [
        {
          "artifact": "generation_context",
          "collection": "$",
          "id": "directives"
        },
        {
          "artifact": "sar2",
          "collection": "action_plan",
          "id": "ks_banner"
        },
        {
          "artifact": "sar2",
          "collection": "action_plan",
          "id": "ks_context"
        },
        {
          "artifact": "sar2",
          "collection": "action_plan",
          "id": "ks_door"
        },
        {
          "artifact": "sar2",
          "collection": "action_plan",
          "id": "ks_facade"
        },
        {
          "artifact": "sar2",
          "collection": "action_plan",
          "id": "ks_left_display"
        },
        {
          "artifact": "sar2",
          "collection": "action_plan",
          "id": "ks_lower_panels"
        },
        {
          "artifact": "sar2",
          "collection": "action_plan",
          "id": "ks_main_sign"
        },
        {
          "artifact": "sar2",
          "collection": "action_plan",
          "id": "ks_right_display"
        },
        {
          "artifact": "sar2",
          "collection": "action_plan",
          "id": "ks_sale_strip"
        },
        {
          "artifact": "sar2",
          "collection": "action_plan",
          "id": "ks_sidewalk"
        },
        {
          "artifact": "sar2",
          "collection": "action_plan",
          "id": "ks_upper_windows"
        }
      ],
      "trace_event_ids": [],
      "value": [
        "KENNYS_ROOFTOP_DESIGN_V1:AUTHORIZED_INFERENCE:excluded:[\"kd_skylight\",\"chimney\",\"water_tank\",\"access_bulkhead\"]",
        "KENNYS_ROOFTOP_DESIGN_V1:AUTHORIZED_INFERENCE:forbid:Do not add excluded components, extra storeys, brands, literal signage, invented microtext, real geography or reference architecture.",
        "KENNYS_ROOFTOP_DESIGN_V1:AUTHORIZED_INFERENCE:forbid:Do not label any design component or KDR relationship as observed source or fidelity to the unknown original rooftop.",
        "KENNYS_ROOFTOP_DESIGN_V1:AUTHORIZED_INFERENCE:forbid:Do not redesign, resize or move source facade openings, door, identity signs or protected source relationships to accommodate rooftop.",
        "KENNYS_ROOFTOP_DESIGN_V1:AUTHORIZED_INFERENCE:forbid:Do not remove observed contextual elements or change weather, wetness, wear intensity or source material identity.",
        "KENNYS_ROOFTOP_DESIGN_V1:AUTHORIZED_INFERENCE:forbid:Do not replace the volumetric design with roof texture only or hide required components completely.",
        "KENNYS_ROOFTOP_DESIGN_V1:AUTHORIZED_INFERENCE:forbid:Do not resolve original hidden geometry, unseen interiors, detailed side/rear facades or urban continuation.",
        "break_protected_relationships:ks_banner",
        "break_protected_relationships:ks_door",
        "break_protected_relationships:ks_facade",
        "break_protected_relationships:ks_left_display",
        "break_protected_relationships:ks_lower_panels",
        "break_protected_relationships:ks_main_sign",
        "break_protected_relationships:ks_right_display",
        "break_protected_relationships:ks_sale_strip",
        "break_protected_relationships:ks_upper_windows",
        "replace_observed_evidence",
        "resolve_locked_unknown_without_evidence"
      ]
    },
    {
      "id": "directive:infer",
      "lock_ids": [],
      "priority": "REQUIRED",
      "source_refs": [
        {
          "artifact": "generation_context",
          "collection": "$",
          "id": "directives"
        },
        {
          "artifact": "sar2",